"Task ID","Task Name","Task Description","Start Time","End Time","Status"
1,"Morning Exercise","30 minutes of running or cycling","06:00","06:30","Completed"
2,"Breakfast","Healthy breakfast with oats and fruits","06:30","07:00","Completed"
3,"Work Start","Beginning of daily work tasks","08:00","12:00","In Progress"
4,"Lunch Break","Time to eat and relax","12:00","13:00","Pending"
5,"Work Continue","Resuming work tasks","13:00","17:00","Pending"
6,"Grocery Shopping","Buy essentials for the week","17:30","18:30","Pending"
7,"Cook Dinner","Prepare a healthy meal","19:00","20:00","Pending"
8,"Evening Leisure","Read a book, watch a movie","20:30","22:00","Pending"
9,"Sleep","Get at least 8 hours of sleep","23:00","07:00","Pending"